catalog,category,subcategory,risk_data_type,title_item,description_item,title_collection,title_short,description_collection,bbox,data_type,format,spatial_scale,coordinate_system,spatial_resolution,spatial_resolution_unit,reference_period,temporal_resolution,temporal_interval,scenarios,data_calculation_type,analysis_type,underlying_data,provider,provider_role,license,link_website,publication_link,publication_type,code_link,code_type,usage_notes,assets,name_contributor
hazard,temperature-related,heat-wave,hazard,GEHE increase,GEHE annual rate of increase,Annual Global High-Resolution Extreme Heat Estimates,GEHE,"The Annual Global High-Resolution Extreme Heat Estimates (GEHE), 1983-2016 data set provides global 0.05 degrees (~5 km) gridded annual counts of the number of days where the maximum Wet Bulb Globe Temperature (WBGTmax) exceeded dangerous hot-humid heat thresholds for the period 1983 to 2016.","-180, -90, 180, 90",raster,geotiff,(near-)global,4326,0.05,decimal degrees,historical,1983-2016,yearly,,inferred,deterministic,ERA5,NASA Socioeconomic Data and Applications Center (SEDAC),licensor,CC-BY-4.0,https://doi.org/10.7927/hff0-k565,https://doi.org/10.1073/pnas.2024792118,article,https://github.com/ecohydro/GlobalUrbanHeat,processing,free user account needed,https://sedac.ciesin.columbia.edu/downloads/data/sdei/sdei-high-res-extreme-heat-estimates-1983-2016/sdei-high-res-extreme-heat-estimates-1983-2016-wbgtmax-trends-geotiff.zip,Lena Reimann
hazard,temperature-related,heat-wave,hazard,GEHE WBGTmax 28 degrees celsius,GEHE Wet Bulb Globe Temperature maximum temperature 28 degrees celsius,Annual Global High-Resolution Extreme Heat Estimates,GEHE,"The Annual Global High-Resolution Extreme Heat Estimates (GEHE), 1983-2016 data set provides global 0.05 degrees (~5 km) gridded annual counts of the number of days where the maximum Wet Bulb Globe Temperature (WBGTmax) exceeded dangerous hot-humid heat thresholds for the period 1983 to 2016.","-180, -90, 180, 90",raster,geotiff,(near-)global,4326,0.05,decimal degrees,historical,1983-2016,yearly,,inferred,deterministic,ERA5,NASA Socioeconomic Data and Applications Center (SEDAC),licensor,CC-BY-4.0,https://doi.org/10.7927/hff0-k565,https://doi.org/10.1073/pnas.2024792118,article,https://github.com/ecohydro/GlobalUrbanHeat,processing,free user account needed,https://sedac.ciesin.columbia.edu/downloads/data/sdei/sdei-high-res-extreme-heat-estimates-1983-2016/sdei-high-res-extreme-heat-estimates-1983-2016-wbgtmax28-counts-geotiff.zip,Lena Reimann
hazard,temperature-related,heat-wave,hazard,GEHE WBGTmax 30 degrees celsius,GEHE Wet Bulb Globe Temperature maximum temperature 30 degrees celsius,Annual Global High-Resolution Extreme Heat Estimates,GEHE,"The Annual Global High-Resolution Extreme Heat Estimates (GEHE), 1983-2016 data set provides global 0.05 degrees (~5 km) gridded annual counts of the number of days where the maximum Wet Bulb Globe Temperature (WBGTmax) exceeded dangerous hot-humid heat thresholds for the period 1983 to 2016.","-180, -90, 180, 90",raster,geotiff,(near-)global,4326,0.05,decimal degrees,historical,1983-2016,yearly,,inferred,deterministic,ERA5,NASA Socioeconomic Data and Applications Center (SEDAC),licensor,CC-BY-4.0,https://doi.org/10.7927/hff0-k565,https://doi.org/10.1073/pnas.2024792118,article,https://github.com/ecohydro/GlobalUrbanHeat,processing,free user account needed,https://sedac.ciesin.columbia.edu/downloads/data/sdei/sdei-high-res-extreme-heat-estimates-1983-2016/sdei-high-res-extreme-heat-estimates-1983-2016-wbgtmax30-counts-geotiff.zip,Lena Reimann
hazard,temperature-related,heat-wave,hazard,GEHE WBGTmax 32 degrees celsius,GEHE Wet Bulb Globe Temperature maximum temperature 32 degrees celsius,Annual Global High-Resolution Extreme Heat Estimates,GEHE,"The Annual Global High-Resolution Extreme Heat Estimates (GEHE), 1983-2016 data set provides global 0.05 degrees (~5 km) gridded annual counts of the number of days where the maximum Wet Bulb Globe Temperature (WBGTmax) exceeded dangerous hot-humid heat thresholds for the period 1983 to 2016.","-180, -90, 180, 90",raster,geotiff,(near-)global,4326,0.05,decimal degrees,historical,1983-2016,yearly,,inferred,deterministic,ERA5,NASA Socioeconomic Data and Applications Center (SEDAC),licensor,CC-BY-4.0,https://doi.org/10.7927/hff0-k565,https://doi.org/10.1073/pnas.2024792118,article,https://github.com/ecohydro/GlobalUrbanHeat,processing,free user account needed,https://sedac.ciesin.columbia.edu/downloads/data/sdei/sdei-high-res-extreme-heat-estimates-1983-2016/sdei-high-res-extreme-heat-estimates-1983-2016-wbgtmax32-counts-geotiff.zip,Lena Reimann
hazard,flood,,hazard,Global Flood Database,The Global Flood Database provides satellite-derived flood footprints and depths for 913 floods that occurred between 2000 and 2018.,,GFD,,"-180, -90, 180, 90",raster,geotiff,(near-)global,4326,0.0022458,decimal degrees,historical,2000-2018,irregular,,inferred,empirical,MODIS satellite imagery,Cloud to Street,licensor,CC-BY-4.0,https://global-flood-database.cloudtostreet.ai/#,https://doi.org/10.1038/s41586-021-03695-w,article,https://github.com/cloudtostreet/MODIS_GlobalFloodDatabase,processing,Download per event possible. The data do not differentiate flood types. ,,Lena Reimann
hazard,flood,fluvial-flood,hazard,GFPLAIN250m ascii,The datasets include the floodplain and floodprone locations at the global level in ascii format,A Global High-resolution Dataset of Earth’s Floodplains,GFPLAIN250m,The datasets aims at providing the floodplain delineation at the global level,"-180, -60, 180, 60",raster,ascii,(near-)global,4326,250,meters,historical,2000,,,inferred,deterministic,Processed from the NASA SRTM Digital Elevation model ,University for Foreigners of Perugia,licensor,CC-BY-4.0,https://figshare.com/articles/dataset/GFPLAIN250m/6665165/1,https://doi.org/10.1038/sdata.2018.309,article,,,,https://figshare.com/ndownloader/files/12186359,Maurizio Mazzoleni
hazard,flood,fluvial-flood,hazard,GFPLAIN250m geotiff,The datasets include the floodplain and floodprone locations at the global level in geotiff format,A Global High-resolution Dataset of Earth’s Floodplains,GFPLAIN250m,The datasets aims at providing the floodplain delineation at the global level,"-180, -60, 180, 60",raster,geotiff,(near-)global,4326,250,meters,historical,2000,,,inferred,deterministic,Processed from the NASA SRTM Digital Elevation model ,University for Foreigners of Perugia,licensor,CC-BY-4.0,https://figshare.com/articles/dataset/GFPLAIN250m/6665165/1,https://doi.org/10.1038/sdata.2018.309,article,,,,https://figshare.com/ndownloader/files/12186356,Maurizio Mazzoleni
hazard,flood,fluvial-flood,hazard,GIEMS 3 arc seconds,GIEMS at 3 arc seconds spatial resolution,Global Inundation Extent from Multi-Satellites,GIEMS,Provides maps of inundation percentage,"-180, -85, 180, 85",raster,,(near-)global,4326,3,arc seconds,historical,1993-2007,monthly,,inferred,empirical,"Multiple passive and active satellite instruments, e.g. AVHRR and SSM/I on-board ERS. Layers for downscaling: HydroSHEDS, GLC2000, GLWD.",Estellus,producer,CC-BY-NC-SA-4.0,https://www.estellus.fr/?static13/giems-d15,http://doi.org/10.1175/JHM-D-16-0155.1,article,,,"The datasets are available from author upon request, see webpage.",,Lena Reimann
hazard,flood,fluvial-flood,hazard,GIEMS 0.25 decimal degrees,GIEMS at 0.25 decimal degrees spatial resolution,Global Inundation Extent from Multi-Satellites,GIEMS,Provides maps of inundation percentage,"-180, -85, 180, 85",raster,,(near-)global,4326,0.25,decimal degrees,historical,1993-2007,monthly,,inferred,empirical,"Multiple passive and active satellite instruments, e.g. AVHRR and SSM/I on-board ERS. Layers for downscaling: HydroSHEDS, GLC2000, GLWD.",Estellus,producer,CC-BY-NC-SA-4.0,https://www.estellus.fr/?static13/giems-d15,http://doi.org/10.1175/JHM-D-16-0155.1,article,,,"The datasets are available from author upon request, see webpage.",,Lena Reimann
hazard,flood,fluvial-flood,hazard,Seasonal reforecasts of river discharge and related data from the Global Flood Awareness System,"The dataset provides a gridded modelled time series of river discharge forced with seasonal range meteorological reforecasts. The data is a consistent representation of a key hydrological variable across the global domain, and is a product of the Global Flood Awareness System (GloFAS).",River discharge and related data from the Global Flood Awareness System,GloFAS,"GloFAS datasets provide daily simulations of river discharge, covering the globe with the exception of Antarctica","-180, -60, 180, 90",raster,GRIB2,(near-)global,4326,0.05,decimal degrees,historical,1981-,daily,,modeled,probabilistic,ECMWF SEAS5,CEMS,producer,CEMS-FLOODS,https://cds.climate.copernicus.eu/cdsapp#!/dataset/cems-glofas-seasonal-reforecast?tab=overview,https://doi.org/10.24381/cds.0aa9b9dd,dataset,,,"Temporal coverage up to near real-time (several months delay), with monthly updates.",,Andrea Vajda
hazard,flood,fluvial-flood,hazard,Reforecasts of river discharge and related data by the Global Flood Awareness System,"This dataset provides a gridded modelled time series of river discharge, forced with medium- to sub-seasonal range meteorological reforecasts. The data is a consistent representation of a key hydrological variable across the global domain, and is a product of the Global Flood Awareness System (GloFAS).",River discharge and related data from the Global Flood Awareness System,GloFAS,"GloFAS datasets provide daily simulations of river discharge, covering the globe with the exception of Antarctica","-180, -60, 180, 90",raster,GRIB2,(near-)global,4326,0.05,decimal degrees,historical,2003-2022,daily,,modeled,probabilistic,ECMWF-ENS,CEMS,producer,CEMS-FLOODS,https://cds.climate.copernicus.eu/cdsapp#!/dataset/cems-glofas-reforecast?tab=overview,https://doi.org/10.24381/cds.2d78664e,dataset,,,"Reforecasts are generated in near real time for each Monday and Thursday as reference dates, 46-day lead time. For each reference date, reforecasts are produced for the past 20 years from 2003 to 2022 (inclusive). The first available reforecast reference date is the 2023-03-27.",,Andrea Vajda
hazard,flood,fluvial-flood,hazard,River discharge and related historical data from the Global Flood Awareness System,A modelled time series of gridded river discharge. It is a product of the Global Flood Awareness System (GloFAS) and offers a consistent representation of a key hydrological variable across the global domain.,River discharge and related data from the Global Flood Awareness System,GloFAS,"GloFAS datasets provide daily simulations of river discharge, covering the globe with the exception of Antarctica","-180, -60, 180, 90",raster,GRIB2,(near-)global,4326,0.05,decimal degrees,historical,1979-,daily,,modelled,deterministic,LISFLOOD  + ERA5,CEMS,producer,CEMS-FLOODS,https://cds.climate.copernicus.eu/cdsapp#!/dataset/cems-glofas-historical?tab=overview,https://doi.org/10.24381/cds.a4fdd6b9,dataset,,,data download via interface or API,,Milana Vuckovic
hazard,flood,fluvial-flood,hazard,River discharge and related forecasted data by the Global Flood Awareness System,This dataset provides an ensemble of forecast time series of gridded hydrological data. The data set is a product of the Global Flood Awareness System (GloFAS) and offers a consistent representation of key hydrological variables across the global domain.,River discharge and related data from the Global Flood Awareness System,GloFAS,"GloFAS datasets provide daily simulations of river discharge, covering the globe with the exception of Antarctica","-180, -60, 180, 90",raster,GRIB2,(near-)global,4326,0.05,decimal degrees,historical,2019-,daily,,modelled,probabilistic,LISFLOOD + ECMWF forecast,CEMS,producer,CEMS-FLOODS,https://cds.climate.copernicus.eu/cdsapp#!/dataset/cems-glofas-forecast?tab=overview,https://doi.org/10.24381/cds.ff1aef77,dataset,,,data download via interface or API,,Milana Vuckovic
hazard,flood,fluvial-flood,hazard,Seasonal forecasts of river discharge and related data by the Global Flood Awareness System,This dataset provides an ensemble of forecasted time series of gridded hydrological data forced with seasonal meteorological forecasts. The data set is a product of the Global Flood Awareness System (GloFAS) and offers a consistent representation of key hydrological variables across the global domain.,River discharge and related data from the Global Flood Awareness System,GloFAS,"GloFAS datasets provide daily simulations of river discharge, covering the globe with the exception of Antarctica","-180, -60, 180, 90",raster,GRIB2,(near-)global,4326,0.05,decimal degrees,historical,2020-,daily,,modelled,probabilistic,LISFLOOD + ECMWF forecast,CEMS,producer,CEMS-FLOODS,https://cds.climate.copernicus.eu/cdsapp#!/dataset/cems-glofas-seasonal?tab=overview,https://doi.org/10.24381/cds.00b6c4fb,dataset,,,data download via interface or API,,Lena Reimann
hazard,flood,fluvial-flood,hazard,Observed flood extent,Composite of the flooded areas mapped as the difference between S-1 observed water extent and the reference water mask.,GloFAS Global Flood Monitoring,GloFAS-GFM,A continuous monitoring of floods worldwide by immediately processing and analyzing all incoming Copernicus Sentinel-1 Synthetic Aperture Radar (SAR) satellite data,"-180, -90, 180, 90",raster,geotiff,(near-)global,4326,10,meters,historical,2015-,irregular,,observed,deterministic,Sentinel-1 SAR,JRC,licensor,CC-BY-4.0,https://www.globalfloods.eu/technical-information/glofas-gfm/,,,,,user account needed for data download,,Dirk Eilander
hazard,flood,fluvial-flood,hazard,Observed water Extent,All pixels classified as open and calm water using Sentinel-1 SAR backscatter intensity.,GloFAS Global Flood Monitoring,GloFAS-GFM,A continuous monitoring of floods worldwide by immediately processing and analyzing all incoming Copernicus Sentinel-1 Synthetic Aperture Radar (SAR) satellite data,"-180, -90, 180, 90",raster,geotiff,(near-)global,4326,10,meters,historical,2015-,irregular,,observed,deterministic,Sentinel-1 SAR,JRC,licensor,CC-BY-4.0,https://www.globalfloods.eu/technical-information/glofas-gfm/,,,,,user account needed for data download,,Dirk Eilander
hazard,flood,fluvial-flood,hazard,GRDC River Discharge Data,"River discharge from in-situ station globaly for 9500 stations. It provides daily, monthly, and long-term statistics",,GRDC,,"-180, -90, 180, 90",tabular,ascii,(near-)global,4326,station,,historical,1955-2016,daily,,inferred,deterministic,,World Meteorological Organization WMO,licensor,CC-BY-4.0,https://portal.grdc.bafg.de/applications/public.html?publicuser=PublicUser#dataDownload/Stations,,,,,,,Maurizio Mazzoleni
hazard,flood,fluvial-flood,hazard,Global Surface Water,"The dataset includes the occurrence, seasonality, recurrence, transitions, and maximum water extent for different temporal moment at global scale",,GSW,,"-180, -56, 180, 78",raster,geotiff,(near-)global,4326,1,arc seconds,historical,1984-2021,monthly,,inferred,deterministic,"precessed from Landsat, SRTM DEM, GTOPO30 DEM, GMTED2010, GHSL, GADM","EC JRC, Google",licensor,CC-BY-4.0,https://jeodpp.jrc.ec.europa.eu/ftp/jrc-opendata/GSWE/,https://doi.org/10.1038/nature20584,article,https://github.com/mentaljam/download_water_data,download,several aggregation levels and download options available,,Maurizio Mazzoleni
hazard,temperature-related,heat-wave,hazard,Heat index historical,Heat index is a heat stress indicator used by the US National Oceanic and Atmospheric Administration (NOAA) National Weather Service for issuing heat warnings. It is calculated using multiple linear regression based on daily maximum temperature and relative humidity (calculated from daily mean specific humidity and surface pressure).,CMIP6 heat stress indicators (HIS),HIS,"The indices are provided for historical and future climate projections (SSP1-2.6, SSP2-4.5, SSP3-7.0, SSP5-8.5) included in the Coupled Model Intercomparison Project Phase 6 (CMIP6) and used in the 6th Assessment Report of the Intergovernmental Panel on Climate Change (IPCC).","-180, -60, 180, 90",raster,netcdf,(near-)global,4326,0.5,decimal degrees,historical,1951-2014,daily,,modeled,deterministic,CMIP6,Copernicus Climate Data Store,host,CC-BY-4.0,https://cds.climate.copernicus.eu/cdsapp#!/dataset/sis-extreme-indices-cmip6?tab=overview,https://doi.org/10.24381/cds.776e08bd,dataset,https://github.com/IPCC-WG1/Atlas/tree/main,processing,data download via interface or API,,Jeremy Pal
hazard,temperature-related,heat-wave,hazard,Heat index future,Heat index is a heat stress indicator used by the US National Oceanic and Atmospheric Administration (NOAA) National Weather Service for issuing heat warnings. It is calculated using multiple linear regression based on daily maximum temperature and relative humidity (calculated from daily mean specific humidity and surface pressure).,CMIP6 heat stress indicators (HIS),HIS,"The indices are provided for historical and future climate projections (SSP1-2.6, SSP2-4.5, SSP3-7.0, SSP5-8.5) included in the Coupled Model Intercomparison Project Phase 6 (CMIP6) and used in the 6th Assessment Report of the Intergovernmental Panel on Climate Change (IPCC).","-180, -60, 180, 90",raster,netcdf,(near-)global,4326,0.5,decimal degrees,future,2015-2100,daily,SSP-RCP combinations,modeled,deterministic,CMIP6,Copernicus Climate Data Store,host,CC-BY-4.0,https://cds.climate.copernicus.eu/cdsapp#!/dataset/sis-extreme-indices-cmip6?tab=overview,https://doi.org/10.24381/cds.776e08bd,dataset,https://github.com/IPCC-WG1/Atlas/tree/main,processing,data download via interface or API,,Jeremy Pal
hazard,temperature-related,heat-wave,hazard,Humidex historical,Humidex is a heat stress indicator used by Canadian meteorological services. It is calculated as linear combination of daily maximum temperature and vapour pressure (calculated from daily mean specific humidity and surface pressure).,CMIP6 heat stress indicators (HIS),HIS,"The indices are provided for historical and future climate projections (SSP1-2.6, SSP2-4.5, SSP3-7.0, SSP5-8.5) included in the Coupled Model Intercomparison Project Phase 6 (CMIP6) and used in the 6th Assessment Report of the Intergovernmental Panel on Climate Change (IPCC).","-180, -60, 180, 90",raster,netcdf,(near-)global,4326,0.5,decimal degrees,historical,1951-2014,daily,,modeled,deterministic,CMIP6,Copernicus Climate Data Store,host,CC-BY-4.0,https://cds.climate.copernicus.eu/cdsapp#!/dataset/sis-extreme-indices-cmip6?tab=overview,https://doi.org/10.24381/cds.776e08bd,dataset,https://github.com/IPCC-WG1/Atlas/tree/main,processing,data download via interface or API,,Jeremy Pal
hazard,temperature-related,heat-wave,hazard,Humidex future,Humidex is a heat stress indicator used by Canadian meteorological services. It is calculated as linear combination of daily maximum temperature and vapour pressure (calculated from daily mean specific humidity and surface pressure).,CMIP6 heat stress indicators (HIS),HIS,"The indices are provided for historical and future climate projections (SSP1-2.6, SSP2-4.5, SSP3-7.0, SSP5-8.5) included in the Coupled Model Intercomparison Project Phase 6 (CMIP6) and used in the 6th Assessment Report of the Intergovernmental Panel on Climate Change (IPCC).","-180, -60, 180, 90",raster,netcdf,(near-)global,4326,0.5,decimal degrees,future,2015-2100,daily,SSP-RCP combinations,modeled,deterministic,CMIP6,Copernicus Climate Data Store,host,CC-BY-4.0,https://cds.climate.copernicus.eu/cdsapp#!/dataset/sis-extreme-indices-cmip6?tab=overview,https://doi.org/10.24381/cds.776e08bd,dataset,https://github.com/IPCC-WG1/Atlas/tree/main,processing,data download via interface or API,,Jeremy Pal
hazard,temperature-related,heat-wave,hazard,Indoor universal thermal climate index historical,"The indoor universal thermal climate index is defined as the air temperature of a reference outdoor environment that would elicit in the human body the same physiological model’s response (sweat production, shivering, skin wettedness, skin blood flow and rectal, mean skin and face temperatures) as the actual environment. Here, a polynomial approximation based on near-surface air temperature, solar radiation, vapor pressure, and wind speed is used for calculating the universal thermal climate index. In the present dataset, the influence of solar radiation and wind speed is not considered, and the universal thermal climate index is calculated from near-surface air temperature and vapor pressure solely, thus representing indoor conditions.",CMIP6 heat stress indicators (HIS),HIS,"The indices are provided for historical and future climate projections (SSP1-2.6, SSP2-4.5, SSP3-7.0, SSP5-8.5) included in the Coupled Model Intercomparison Project Phase 6 (CMIP6) and used in the 6th Assessment Report of the Intergovernmental Panel on Climate Change (IPCC).","-180, -60, 180, 90",raster,netcdf,(near-)global,4326,0.5,decimal degrees,historical,1951-2014,daily,,modeled,deterministic,CMIP6,Copernicus Climate Data Store,host,CC-BY-4.0,https://cds.climate.copernicus.eu/cdsapp#!/dataset/sis-extreme-indices-cmip6?tab=overview,https://doi.org/10.24381/cds.776e08bd,dataset,https://github.com/IPCC-WG1/Atlas/tree/main,processing,data download via interface or API,,Jeremy Pal
hazard,temperature-related,heat-wave,hazard,Indoor universal thermal climate index future,"The indoor universal thermal climate index is defined as the air temperature of a reference outdoor environment that would elicit in the human body the same physiological model’s response (sweat production, shivering, skin wettedness, skin blood flow and rectal, mean skin and face temperatures) as the actual environment. Here, a polynomial approximation based on near-surface air temperature, solar radiation, vapor pressure, and wind speed is used for calculating the universal thermal climate index. In the present dataset, the influence of solar radiation and wind speed is not considered, and the universal thermal climate index is calculated from near-surface air temperature and vapor pressure solely, thus representing indoor conditions.",CMIP6 heat stress indicators (HIS),HIS,"The indices are provided for historical and future climate projections (SSP1-2.6, SSP2-4.5, SSP3-7.0, SSP5-8.5) included in the Coupled Model Intercomparison Project Phase 6 (CMIP6) and used in the 6th Assessment Report of the Intergovernmental Panel on Climate Change (IPCC).","-180, -60, 180, 90",raster,netcdf,(near-)global,4326,0.5,decimal degrees,future,2015-2100,daily,SSP-RCP combinations,modeled,deterministic,CMIP6,Copernicus Climate Data Store,host,CC-BY-4.0,https://cds.climate.copernicus.eu/cdsapp#!/dataset/sis-extreme-indices-cmip6?tab=overview,https://doi.org/10.24381/cds.776e08bd,dataset,https://github.com/IPCC-WG1/Atlas/tree/main,processing,data download via interface or API,,Jeremy Pal
hazard,temperature-related,heat-wave,hazard,Indoor wet-bulb globe temperature index historical,"Indoor wet-bulb globe temperature is a heat stress indicator that is calculated as weighted mean of wet-bulb temperature, globe temperature, and daily maximum temperature. In the present dataset, the influence of solar radiation and wind speed is not considered and wet-bulb globe temperature is calculated as weighted mean of wet-bulb temperature and daily maximum temperature (neglecting globe temperature). It thus represents indoor conditions.",CMIP6 heat stress indicators (HIS),HIS,"The indices are provided for historical and future climate projections (SSP1-2.6, SSP2-4.5, SSP3-7.0, SSP5-8.5) included in the Coupled Model Intercomparison Project Phase 6 (CMIP6) and used in the 6th Assessment Report of the Intergovernmental Panel on Climate Change (IPCC).","-180, -60, 180, 90",raster,netcdf,(near-)global,4326,0.5,decimal degrees,historical,1951-2014,daily,,modeled,deterministic,CMIP6,Copernicus Climate Data Store,host,CC-BY-4.0,https://cds.climate.copernicus.eu/cdsapp#!/dataset/sis-extreme-indices-cmip6?tab=overview,https://doi.org/10.24381/cds.776e08bd,dataset,https://github.com/IPCC-WG1/Atlas/tree/main,processing,data download via interface or API,,Jeremy Pal
hazard,temperature-related,heat-wave,hazard,Indoor wet-bulb globe temperature index future,"Indoor wet-bulb globe temperature is a heat stress indicator that is calculated as weighted mean of wet-bulb temperature, globe temperature, and daily maximum temperature. In the present dataset, the influence of solar radiation and wind speed is not considered and wet-bulb globe temperature is calculated as weighted mean of wet-bulb temperature and daily maximum temperature (neglecting globe temperature). It thus represents indoor conditions.",CMIP6 heat stress indicators (HIS),HIS,"The indices are provided for historical and future climate projections (SSP1-2.6, SSP2-4.5, SSP3-7.0, SSP5-8.5) included in the Coupled Model Intercomparison Project Phase 6 (CMIP6) and used in the 6th Assessment Report of the Intergovernmental Panel on Climate Change (IPCC).","-180, -60, 180, 90",raster,netcdf,(near-)global,4326,0.5,decimal degrees,future,2015-2100,daily,SSP-RCP combinations,modeled,deterministic,CMIP6,Copernicus Climate Data Store,host,CC-BY-4.0,https://cds.climate.copernicus.eu/cdsapp#!/dataset/sis-extreme-indices-cmip6?tab=overview,https://doi.org/10.24381/cds.776e08bd,dataset,https://github.com/IPCC-WG1/Atlas/tree/main,processing,data download via interface or API,,Jeremy Pal
